{
  "$schema":"https://json-schema.org/draft/2020-12/schema", "$id":"m0a://schemas/narrative/chapter-plan.r1.schema.json", "title":"ChapterPlanR1", "type":"object",
  "properties":{
    "payloadSchema":{"const":"chapter-plan.r1"}, "chapterId":{"type":"string","minLength":1}, "compiledFromProjectRevision":{"type":"integer","minimum":0}, "compiledFromStateDigest":{"type":"string","pattern":"^[a-f0-9]{64}$"}, "contextManifestRef":{"$ref":"../artifact/artifact-ref.schema.json"}, "chapterGoal":{"type":"string","minLength":1}, "activeTaskRefs":{"type":"array","items":{"type":"string"}},
    "continuityActions":{"type":"array","items":{"type":"object","properties":{"threadRef":{"type":"string","minLength":1},"disposition":{"type":"string","enum":["ADVANCE","RESOLVE","DEFER_WITH_BRIDGE","NO_LONGER_APPLICABLE_CHANGE_REQUEST"]},"bridge":{"type":["string","null"]}},"required":["threadRef","disposition"],"additionalProperties":false}}, "requiredStateOutcomes":{"type":"array","items":{"$ref":"narrative-definitions.schema.json#/$defs/Condition"}}, "forbiddenTransitions":{"type":"array","items":{"$ref":"narrative-definitions.schema.json#/$defs/Condition"}}, "knowledgeBoundaries":{"type":"array","items":{"type":"string"}}, "reservationRefs":{"type":"array","items":{"type":"string"}}, "sceneExecution":{"type":"array"}, "horizonPreview":{"type":"array","items":{"$ref":"narrative-definitions.schema.json#/$defs/HorizonSlot"}}
  },
  "required":["payloadSchema","chapterId","compiledFromProjectRevision","compiledFromStateDigest","contextManifestRef","chapterGoal","activeTaskRefs","continuityActions","requiredStateOutcomes","forbiddenTransitions","knowledgeBoundaries","reservationRefs","sceneExecution","horizonPreview"], "additionalProperties":false
}
