{"payloadSchema":"chapter-plan.r1","chapterId":"chapter:1","compiledFromProjectRevision":0,"compiledFromStateDigest":"aaaaaaaaaaaaaaaaaaaaaaaaaaaaaaaaaaaaaaaaaaaaaaaaaaaaaaaaaaaaaaaa","contextManifestRef":{"artifactId":"context:1","version":1,"payloadHash":"aaaaaaaaaaaaaaaaaaaaaaaaaaaaaaaaaaaaaaaaaaaaaaaaaaaaaaaaaaaaaaaa"},"chapterGoal":"goal","activeTaskRefs":[],"continuityActions":[],"requiredStateOutcomes":[],"forbiddenTransitions":[],"knowledgeBoundaries":[],"reservationRefs":[],"sceneExecution":[],"horizonPreview":[]}
